{
  "schema_version": "1.0.0",
  "case_id": "CASE-TB-001",
  "observations": [
    {
      "record_id": "CASE-TB-001",
      "source_system": "CASES_SIM",
      "source_record_id": "CASE-TB-001",
      "subject_ref": "SYN-SUBJ-001",
      "record_type": "cases",
      "observed_at": "2026-09-01T08:00:00Z",
      "details": {
        "case_id": "CASE-TB-001",
        "source_table": "cases"
      }
    },
    {
      "record_id": "ORD-TB-001",
      "source_system": "LAB_SIM",
      "source_record_id": "ROW-ORD-001-A",
      "subject_ref": "SYN-SUBJ-001",
      "record_type": "lab_orders",
      "observed_at": "2026-09-01T11:00:00Z",
      "details": {
        "case_id": "CASE-TB-001",
        "source_table": "lab_orders",
        "screening_event_id": "SCR-TB-001"
      }
    }
  ],
  "exceptions": [],
  "source_checks": [
    {
      "source_system": "cases",
      "attempt": 1,
      "status": "available"
    },
    {
      "source_system": "lab_orders",
      "attempt": 1,
      "status": "available"
    }
  ],
  "requires_human_approval": true
}
